{"artifacts":[{"artifactId":"synthetic-model-request","commitmentMode":"EXACT_INPUT","digest":{"algorithm":"sha-256","value":"48b4187cab1d88d71b73e51d368bb1396b0b5a2b992be8f943238a7f56fcd1ad"},"mediaType":"application/json","role":"UPSTREAM_REQUEST","sizeBytes":410},{"artifactId":"synthetic-model-response","commitmentMode":"EXACT_INPUT","digest":{"algorithm":"sha-256","value":"70dc12ef30e529fe011bea434722cf0382c38ab19bc374f77a2e13f499fd0ca7"},"mediaType":"application/json","role":"UPSTREAM_RESPONSE","sizeBytes":1445},{"artifactId":"synthetic-model-rubric","commitmentMode":"EXACT_INPUT","digest":{"algorithm":"sha-256","value":"ceae88238630ead210843c52c24cc4ae0af1a34d432e62df11889db3fe804ef9"},"mediaType":"application/json","role":"POLICY","sizeBytes":412}],"createdAt":"2026-07-21T12:10:00Z","criteria":[{"criterionId":"criterion-synthetic-claim-01","parameters":[{"name":"claim-index","value":0},{"name":"supported-pointer","value":"/response/claims/0/supported"},{"name":"confidence-pointer","value":"/response/claims/0/confidence"},{"name":"notes-pointer","value":"/response/claims/0/notes"}],"predicateId":"source-claim-assessment","required":true,"statement":"The response is clear and relevant to the brief."},{"criterionId":"criterion-synthetic-claim-02","parameters":[{"name":"claim-index","value":1},{"name":"supported-pointer","value":"/response/claims/1/supported"},{"name":"confidence-pointer","value":"/response/claims/1/confidence"},{"name":"notes-pointer","value":"/response/claims/1/notes"}],"predicateId":"source-claim-assessment","required":true,"statement":"The response contains no factual errors."},{"criterionId":"criterion-synthetic-claim-03","parameters":[{"name":"claim-index","value":2},{"name":"supported-pointer","value":"/response/claims/2/supported"},{"name":"confidence-pointer","value":"/response/claims/2/confidence"},{"name":"notes-pointer","value":"/response/claims/2/notes"}],"predicateId":"source-claim-assessment","required":true,"statement":"The response satisfies every unstated buyer preference."}],"economicBoundary":{"paymentExecution":"OUT_OF_SCOPE","paymentRecommendation":"OUT_OF_SCOPE"},"expiresAt":"2026-07-22T12:10:00Z","operation":"NORMALIZE","privacy":{"classification":"PUBLIC_SYNTHETIC","trainingUse":false},"profile":{"digest":{"algorithm":"sha-256","value":"44ac90c7f4de6e5e26d8641bfb7ac68fc2cf70115987edfe6ed1fe834ec6ec2c"},"id":"synthetic-model-judgment-normalization-v0","version":"0.1.0"},"proof":{"jws":"eyJhbGciOiJFZERTQSIsImtpZCI6ImpTMlRoVEpPaFBpak50WjVta01Lb1FGZEVlTXRCRm1ZRnVVVEJzRU9FYjQiLCJ0eXAiOiJldmFsZG9zc2llci5ldmFsdWF0aW9uLXJlcXVlc3QvMC4xIn0..IkUaDdwZBIT6dXY0l744tp4a_j18JpeJ0x1PoPIDuzLlr_Rxojr038SOAjQoyyff5RUOQkQudfBgspRC4xeTCQ","type":"evaldossier.detached-jws/0.1"},"protocolVersion":"evaldossier/0.1","requestId":"model-judgment-normalization-request-v0","requester":{"id":"evaldossier-demo-requester","key":{"alg":"EdDSA","crv":"Ed25519","kid":"jS2ThTJOhPijNtZ5mkMKoQFdEeMtBFmYFuUTBsEOEb4","kty":"OKP","use":"sig","x":"A783NVGM60KSfyMLFn7puJpkUiFHvBVu_95mc8hzDW0"}},"schemaVersion":"evaldossier.evaluation-request/0.1","signatureContext":{"audience":"evaldossier-offline-demo","nonce":"model-judgment-request-nonce-0001"},"signingKeyId":"jS2ThTJOhPijNtZ5mkMKoQFdEeMtBFmYFuUTBsEOEb4","statement":"Normalize the exact synthetic model-judgment fixture without establishing factual truth or recommending an economic action.","targetEvaluatorId":"evaldossier-model-judgment-fixture-adapter"}