{"artifacts":[{"artifactId":"reference-deliverable","commitmentMode":"EXACT_INPUT","digest":{"algorithm":"sha-256","value":"f911b962ff89233ef3dd9e908ab1be39d9615016835995f71b97d20fe9714baa"},"mediaType":"application/json","role":"DELIVERABLE","sizeBytes":248},{"artifactId":"reference-deliverable-schema","commitmentMode":"EXACT_INPUT","digest":{"algorithm":"sha-256","value":"11a39e270ae164b77ae6c7054baae2b0592921be17a3c3449281b36e1aa3111f"},"mediaType":"application/schema+json","role":"SCHEMA","sizeBytes":787}],"createdAt":"2026-07-21T12:00:01Z","criteria":[{"criterionId":"criterion-artifact-present","parameters":[{"name":"artifact-id","value":"reference-deliverable"}],"predicateId":"artifact-present","required":true,"statement":"The deliverable artifact is present and non-empty."},{"criterionId":"criterion-artifact-digest","parameters":[{"name":"artifact-id","value":"reference-deliverable"}],"predicateId":"artifact-digest-matches","required":true,"statement":"The deliverable digest and size match their precommitted values."},{"criterionId":"criterion-json-schema","parameters":[{"name":"artifact-id","value":"reference-deliverable"},{"name":"schema-artifact-id","value":"reference-deliverable-schema"}],"predicateId":"local-json-schema-valid","required":true,"statement":"The deliverable is valid against the committed local-only JSON Schema."}],"economicBoundary":{"paymentExecution":"OUT_OF_SCOPE","paymentRecommendation":"OUT_OF_SCOPE"},"expiresAt":"2026-07-22T12:00:01Z","operation":"EVALUATE","privacy":{"classification":"PUBLIC_SYNTHETIC","trainingUse":false},"profile":{"digest":{"algorithm":"sha-256","value":"57e50c3fbd00ae371d6bf60b192bf0d739c092bcdb4011330a0198a9a79b792a"},"id":"json-artifact-conformance-v0","version":"0.1.0"},"proof":{"jws":"eyJhbGciOiJFZERTQSIsImtpZCI6ImQ0VWhTUU5yWWF1MWxRSXR5U2o0bU1xbWFTTmVqR1hjWFF6MkZEMHg3a0kiLCJ0eXAiOiJldmFsZG9zc2llci5ldmFsdWF0aW9uLXJlcXVlc3QvMC4xIn0..2D1JxIrXe90GmI2JsDuSqapmokFNIKlWA8q5wPIDWqfFnljPsyeg7JwYvzyd0eJiQE3LMVGjcI6VfZBQqgQ1Cg","type":"evaldossier.detached-jws/0.1"},"protocolVersion":"evaldossier/0.1","requestId":"reference-evaluation-request-v0","requester":{"id":"evaldossier-demo-requester","key":{"alg":"EdDSA","crv":"Ed25519","kid":"d4UhSQNrYau1lQItySj4mMqmaSNejGXcXQz2FD0x7kI","kty":"OKP","use":"sig","x":"1087eeo8BF1sZIl0ZNs5qe6A0zkZL4c9Kmlh0R3DJgc"}},"schemaVersion":"evaldossier.evaluation-request/0.1","signatureContext":{"audience":"evaldossier-offline-demo","nonce":"reference-request-nonce-0001"},"signingKeyId":"d4UhSQNrYau1lQItySj4mMqmaSNejGXcXQz2FD0x7kI","statement":"Evaluate the committed JSON deliverable against the three required formal predicates.","targetEvaluatorId":"evaldossier-reference-evaluator"}